{
  "canonical_inputs": [
    "docs/meta/knowledge/DECISION_RUNTIME_MODEL.md",
    "generated/knowledge/review-decision.json",
    "generated/skills/evidence-sufficiency-map.json",
    "generated/skills/skill-registry.json"
  ],
  "diff_range": "origin/main...HEAD",
  "generated_by": "tools/knowledge/build_evidence_obligations.py",
  "obligations": [
    {
      "advisory_note": "",
      "blocking": false,
      "evidence_class": "docs_policy",
      "obligation_type": "required_status_update",
      "source_rule": "all-required-reviewers-must-confirm-or-explicitly-delegate",
      "triggered_by_skills": [
        "docs-truth-review"
      ]
    },
    {
      "advisory_note": "",
      "blocking": false,
      "evidence_class": "catalog_governance",
      "obligation_type": "required_status_update",
      "source_rule": "all-required-reviewers-must-confirm-or-explicitly-delegate",
      "triggered_by_skills": [
        "docs-truth-review"
      ]
    }
  ],
  "pack_id": "evidence-obligations",
  "required_adr_updates": [],
  "required_evidence_packs": [],
  "required_plan_testplan_refreshes": [],
  "required_runbook_updates": [],
  "required_status_updates": [
    "catalog_governance",
    "docs_policy"
  ],
  "schema_version": 1,
  "source_range": "origin/main...HEAD"
}
